Capability Domain,Current State Questions,Target State,Gap Analysis Questions
Cryptographic Visibility,Do we know where all cryptography is used? Is our inventory complete and up-to-date?,Complete automated inventory with continuous monitoring and real-time updates,What discovery tools exist? What are our blind spots? How often is inventory updated? Who owns the inventory?
Risk Management,Is quantum risk in our enterprise risk register? Do we understand HNDL exposure?,Integrated quantum risk framework with board oversight and regular assessment,What is our risk appetite? Which assets are most critical? What is our HNDL exposure? How do we measure risk?
Vendor Ecosystem,Have we engaged suppliers on PQC readiness? Do they have concrete plans?,All critical vendors committed with documented timelines and CBOMs provided,Which vendors are quantum-ready? What dependencies exist? Are contracts updated? What are backup plans?
Technical Capability,Can we deploy PQC today? Do our systems support quantum-safe algorithms?,Crypto-agile infrastructure with hybrid implementations and automated updates,Do systems support PQC? What is the performance impact? Are there compatibility issues? Can we rollback?
Workforce Readiness,Does our team understand quantum threats? Do we have necessary expertise?,Trained workforce with specialized PQC expertise and continuous learning,What training is needed? What skill gaps exist? Do we need to hire? Can we access consultants?
Compliance & Standards,Do we meet emerging PQC regulations? Are we audit-ready?,Full compliance with NIST standards and all industry/regional regulations,Which regulations apply to us? Are we audit-ready? Is documentation complete? What are reporting requirements?
